{
  "$schema": "https://json-schema.org/draft/2020-12/schema",
  "title": "Category tree",
  "description": "The category tree: a flat list, a tree through parent.",
  "type": "object",
  "x-order": [
    "$schema",
    "kind",
    "id",
    "name",
    "displayName",
    "pluralName",
    "description",
    "stereotypes",
    "tags",
    "category",
    "categories",
    "properties",
    "generation",
    "source"
  ],
  "properties": {
    "$schema": {
      "$ref": "common.json#/$defs/schemaPath"
    },
    "kind": {
      "const": "category-tree"
    },
    "id": {
      "$ref": "common.json#/$defs/id"
    },
    "name": {
      "$ref": "common.json#/$defs/label",
      "default": ""
    },
    "displayName": {
      "type": "string"
    },
    "pluralName": {
      "type": "string"
    },
    "description": {
      "$ref": "common.json#/$defs/description"
    },
    "stereotypes": {
      "$ref": "common.json#/$defs/keyList",
      "default": []
    },
    "tags": {
      "$ref": "common.json#/$defs/tagList",
      "default": []
    },
    "category": {
      "$ref": "common.json#/$defs/id"
    },
    "categories": {
      "type": "array",
      "x-sort": "order",
      "items": {
        "title": "Category",
        "type": "object",
        "x-order": [
          "id",
          "name",
          "displayName",
          "pluralName",
          "parent",
          "order",
          "description",
          "stereotypes",
          "tags",
          "category",
          "properties",
          "generation",
          "source"
        ],
        "properties": {
          "id": {
            "$ref": "common.json#/$defs/id"
          },
          "name": {
            "$ref": "common.json#/$defs/label",
            "default": ""
          },
          "displayName": {
            "type": "string"
          },
          "pluralName": {
            "type": "string"
          },
          "parent": {
            "$ref": "common.json#/$defs/id"
          },
          "order": {
            "type": "integer"
          },
          "description": {
            "$ref": "common.json#/$defs/description"
          },
          "stereotypes": {
            "$ref": "common.json#/$defs/keyList",
            "default": []
          },
          "tags": {
            "$ref": "common.json#/$defs/tagList",
            "default": []
          },
          "category": {
            "$ref": "common.json#/$defs/id"
          },
          "properties": {
            "$ref": "common.json#/$defs/properties",
            "default": {}
          },
          "generation": {
            "$ref": "common.json#/$defs/generation",
            "default": {}
          },
          "source": {
            "$ref": "common.json#/$defs/source"
          }
        },
        "required": ["id", "name"],
        "additionalProperties": false
      },
      "default": []
    },
    "properties": {
      "$ref": "common.json#/$defs/properties",
      "default": {}
    },
    "generation": {
      "$ref": "common.json#/$defs/generation",
      "default": {}
    },
    "source": {
      "$ref": "common.json#/$defs/source"
    }
  },
  "required": ["kind", "id", "name"],
  "additionalProperties": false
}
